{
  "clients": [
    {
      "client_id": "sim-client-id",
      "client_secret": "sim-client-secret",
      "tenant_id": "sim-tenant-id"
    }
  ],
  "users": [
    {
      "email": "admin@saldeti.local",
      "display_name": "Admin User",
      "password": "Simulator123!",
      "given_name": "Admin",
      "surname": "User",
      "job_title": "Administrator",
      "department": "IT",
      "assigned_licenses": [
        {"skuPartNumber": "SPE_E5"}
      ]
    },
    {
      "email": "alice.smith@saldeti.local",
      "display_name": "Alice Smith",
      "password": "Simulator123!",
      "given_name": "Alice",
      "surname": "Smith",
      "job_title": "Software Engineer",
      "department": "Engineering",
      "manager_upn": "eve.wilson@saldeti.local",
      "assigned_licenses": [
        {"skuPartNumber": "SPE_E3", "disabledPlans": ["MCOSTANDARD"]}
      ]
    },
    {
      "email": "bob.jones@saldeti.local",
      "display_name": "Bob Jones",
      "password": "Simulator123!",
      "given_name": "Bob",
      "surname": "Jones",
      "job_title": "Senior Engineer",
      "department": "Engineering",
      "manager_upn": "eve.wilson@saldeti.local",
      "assigned_licenses": [
        {"skuPartNumber": "SPE_E3"}
      ]
    },
    {
      "email": "charles.brennan@saldeti.local",
      "display_name": "Charles Brennan",
      "password": "Simulator123!",
      "given_name": "Charles",
      "surname": "Brennan",
      "job_title": "Marketing Manager",
      "department": "Marketing",
      "assigned_licenses": [
        {"skuPartNumber": "SPE_E3"}
      ]
    },
    {
      "email": "diana.palmer@saldeti.local",
      "display_name": "Diana Palmer",
      "password": "Simulator123!",
      "given_name": "Diana",
      "surname": "Palmer",
      "job_title": "HR Director",
      "department": "HR",
      "manager_upn": "admin@saldeti.local",
      "assigned_licenses": [
        {"skuPartNumber": "SPE_E3"}
      ]
    },
    {
      "email": "eve.wilson@saldeti.local",
      "display_name": "Eve Wilson",
      "password": "Simulator123!",
      "given_name": "Eve",
      "surname": "Wilson",
      "job_title": "Tech Lead",
      "department": "Engineering",
      "manager_upn": "frank.miller@saldeti.local",
      "assigned_licenses": [
        {"skuPartNumber": "SPE_E5"},
        {"skuPartNumber": "EMS"}
      ]
    },
    {
      "email": "frank.miller@saldeti.local",
      "display_name": "Frank Miller",
      "password": "Simulator123!",
      "given_name": "Frank",
      "surname": "Miller",
      "job_title": "CFO",
      "department": "Finance",
      "manager_upn": "admin@saldeti.local",
      "assigned_licenses": [
        {"skuPartNumber": "SPE_E5"}
      ]
    },
    {
      "email": "grace.lee@saldeti.local",
      "display_name": "Grace Lee",
      "password": "Simulator123!",
      "given_name": "Grace",
      "surname": "Lee",
      "job_title": "Intern",
      "department": "Engineering",
      "enabled": false
    },
    {
      "email": "henry.taylor@saldeti.local",
      "display_name": "Henry Taylor",
      "password": "Simulator123!",
      "given_name": "Henry",
      "surname": "Taylor",
      "job_title": "Account Executive",
      "department": "Sales",
      "assigned_licenses": [
        {"skuPartNumber": "SPE_E3"}
      ]
    },
    {
      "email": "ivan.guest@external.com",
      "display_name": "Ivan Guest",
      "password": "Simulator123!",
      "given_name": "Ivan",
      "surname": "Guest",
      "is_guest": true
    },
    {
      "email": "julia.robertson@saldeti.local",
      "display_name": "Julia Robertson",
      "password": "Simulator123!",
      "given_name": "Julia",
      "surname": "Robertson",
      "job_title": "Content Writer",
      "department": "Marketing",
      "assigned_licenses": [
        {"skuPartNumber": "SPE_E3"}
      ]
    }
  ],
  "groups": [
    {
      "display_name": "Engineering Team",
      "description": "Engineering department",
      "mail_nickname": "engineeringteam",
      "visibility": "Public",
      "member_upns": [
        "alice.smith@saldeti.local",
        "bob.jones@saldeti.local",
        "eve.wilson@saldeti.local",
        "grace.lee@saldeti.local"
      ]
    },
    {
      "display_name": "Marketing Team",
      "description": "Marketing department",
      "mail_nickname": "marketingteam",
      "visibility": "Public",
      "member_upns": [
        "charles.brennan@saldeti.local",
        "julia.robertson@saldeti.local"
      ]
    },
    {
      "display_name": "All Staff",
      "description": "All employees",
      "mail_nickname": "allstaff",
      "visibility": "Public",
      "member_upns": [
        "alice.smith@saldeti.local",
        "bob.jones@saldeti.local",
        "charles.brennan@saldeti.local",
        "diana.palmer@saldeti.local",
        "eve.wilson@saldeti.local",
        "frank.miller@saldeti.local",
        "henry.taylor@saldeti.local",
        "julia.robertson@saldeti.local"
      ],
      "member_group_names": [
        "Engineering Team",
        "Marketing Team"
      ]
    },
    {
      "display_name": "Leadership",
      "description": "Leadership team",
      "mail_nickname": "leadership",
      "visibility": "Private",
      "member_upns": [
        "diana.palmer@saldeti.local",
        "frank.miller@saldeti.local"
      ]
    },
    {
      "display_name": "Project Alpha",
      "description": "Project Alpha team",
      "mail_nickname": "projectalpha",
      "visibility": "Public",
      "group_types": ["Unified"],
      "member_upns": [
        "alice.smith@saldeti.local",
        "charles.brennan@saldeti.local",
        "eve.wilson@saldeti.local"
      ]
    }
  ],
  "applications": [
    {
      "display_name": "Saldeti Simulator App",
      "app_id": "sim-client-id",
      "description": "Default simulator application registration",
      "sign_in_audience": "AzureADandPersonalMicrosoftAccount",
      "app_roles": [
        {
          "allowed_member_types": ["Application"],
          "description": "Allows the application to read all applications",
          "display_name": "Application.Read.All",
          "is_enabled": true,
          "value": "Application.Read.All"
        }
      ]
    }
  ]
}
